Level,Policy_Type,Description,Value_Based_Rules,Trigger,Outcome,Next_Step
1,RETURN POLICY,"First line of customer service - handles change of mind, not as described, DOA",Standard processing for <₹20K; Enhanced verification for ₹20K-50K; Priority inspection for >₹50K,Customer complaint within return window,Return approved/rejected based on conditions,If approved → Replacement process; If rejected → Warranty check
2,REPLACEMENT POLICY,Handles manufacturing defects and quality issues,Standard logistics for <₹20K; Expedited shipping for ₹20K-50K; White-glove service for >₹50K,Return approved or warranty claim for defective product,New product of same model provided if available,If replacement unavailable → Refund process
3,REFUND POLICY,Last resort when return approved but replacement impossible,Auto-approval <₹5K; Manager approval ₹5K-50K; Senior approval >₹50K; Processing time: 7-14 business days,Replacement unavailable or customer preference (category dependent),Monetary refund via specified method,Case closed or escalation to consumer forum
4,WARRANTY POLICY,Manufacturer guarantee for specified period beyond return window,Standard service center for all values; On-site service available for products >₹30K,Product failure beyond return window but within warranty,Service center repair or replacement as per warranty terms,Service center handling or manufacturer liaison
5,LEGAL ESCALATION,Consumer Protection Act 2019 rights and forum mechanism,"Consumer forum jurisdiction based on claim value: District (<₹1 crore), State, National",Customer unsatisfied with company resolution,Consumer forum adjudication and binding orders,Legal compliance and enforcement
